{
  "$schema": "./calibration.schema.json",
  "meta": {
    "schemaVersion": "1.0.0",
    "calibrationVersion": "1.0.0",
    "task": "Phase 1 · V6 — calibration layer",
    "robotId": "reference-uncalibrated",
    "generatedAt": "2026-08-23T00:00:00Z",
    "generatedBy": "scripts/build-calibration.mjs",
    "regenerateWith": "pnpm build:calibration",
    "validateWith": "pnpm validate:calibration",
    "layersOver": {
      "path": "hardware/joint-map.json",
      "jointMapVersion": "1.1.0",
      "sha256": "d6f60e830679cc65e580db78fa9afb5e34f89d5486fde34ae2261f296f8ce6d5",
      "note": "This document LAYERS OVER the joint map; it does not fork it. Identity (firmwareName, firmwareIndex, pins, kind), geometry (rotationAxis, pivotOrigin, cadPose) and the firmware clamp stay in joint-map.json and are not repeated here. Only hardware-gated values appear here, and every carried-forward one is re-derived from the joint map by the validator."
    },
    "epistemicContract": "Every field is either measured:false (a carried-forward default, equal to today's value, with the method and what would settle it) or measured:true (with a timestamp, an operator, a ROBOT SERIAL, an instrument and a procedure step). A carried-forward value may not differ from the design value it layers over: you cannot change a number without claiming you measured it, and you cannot claim you measured it without naming a robot. Nothing in this document has been measured.",
    "calibrationStatus": "uncalibrated",
    "measuredFieldCount": 0,
    "totalFieldCount": 81,
    "checklist": "docs/findings/V6-hardware-verification-checklist.md",
    "consumers": [
      "@sesame-lab/sesame-model (CalibrationView; loadCalibration from ./node)",
      "@sesame-lab/sesame-sim (via CalibrationView.toSimOptions() — subtrim, power-on angle, slew, loop quanta)",
      "apps/web (via CalibrationView.toRigCalibration() — not yet wired; see V6 findings section 6)"
    ]
  },
  "session": null,
  "joints": [
    {
      "firmwareName": "R1",
      "firmwareIndex": 0,
      "directionSign": {
        "value": 1,
        "measured": false,
        "source": "hardware/joint-map.json joints[R1].directionSign.value",
        "method": "Inferred by F6 from the 223-step choreography corpus: applying these signs collapses runRestPose to 0 on all eight and runStandPose to +45 hips / +90 feet. A bookkeeping convention for the body-relative formula, not a physical direction.",
        "wouldBeConfirmedBy": [
          "Commanding one joint of each shape class from 90 deg to 135 deg on a built robot and confirming the two classes move in opposite body-relative directions (checklist V6-18)."
        ],
        "checklistStep": "V6-18",
        "closesIssues": [
          "ISSUE-20260823-007"
        ]
      },
      "rotationSenseSign": {
        "value": -1,
        "measured": false,
        "source": "hardware/joint-map.json joints[R1].directionSign.absoluteSense.rule",
        "method": "Fitted exactly by V0 over the CAD servo-horn occurrences: alpha = slope * (commandedDeg - 90) + offset solves uniquely with offset 0 and zero residual. A statement about the DESIGN, resting on two stated assumptions - that the CAD is drawn in runStandPose, and that the servo turns one shaft degree per commanded degree.",
        "wouldBeConfirmedBy": [
          "Commanding this joint from 90 deg to 135 deg on an elevated built robot and watching which way the child link swings (checklist V6-18)."
        ],
        "checklistStep": "V6-18",
        "closesIssues": [
          "ISSUE-20260823-007"
        ],
        "note": "This is the sign baked into assets/sesame.glb as extras.signPerCommandedDeg. Overriding it here does NOT rewrite the GLB - see docs/findings/V6-calibration-and-hardware-checklist.md section 5."
      },
      "zeroReferenceDeg": {
        "value": 90,
        "measured": false,
        "source": "hardware/joint-map.json joints[R1].zeroReferenceDeg.value",
        "method": "Inferred by F6 from four independent places: runRestPose commands all eight to 90 in one loop; the build guide calibrates every motor to 90 with no horn fitted; servoSubtrim[] defaults to zeros; sesame-angle-guide.png draws 90 as the shared hinge. NOT MEASURED on any robot.",
        "wouldBeConfirmedBy": [
          "Commanding 90 deg on a built robot with the leg fitted and reading the actual link angle against the body with a protractor; the difference is this joint's horn-spline offset (checklist V6-19, V6-20)."
        ],
        "checklistStep": "V6-20",
        "closesIssues": [
          "ISSUE-20260823-007"
        ]
      },
      "servoSubtrimDeg": {
        "value": 0,
        "measured": false,
        "source": "firmware/sesame-firmware-main.ino:113 — int8_t servoSubtrim[8] = {0,0,0,0,0,0,0,0}",
        "method": "The firmware default. Subtrim is per-build by construction and the stock firmware never persists it: `subtrim save` prints a C initialiser for a human to paste back into source.",
        "wouldBeConfirmedBy": [
          "A calibration run on a specific robot: command the rest pose, trim each channel until the link matches the reference geometry, then read the values back with the serial `subtrim` command (checklist V6-20)."
        ],
        "checklistStep": "V6-20",
        "closesIssues": [
          "ISSUE-20260823-007",
          "unresolved:horn-spline-quantisation"
        ],
        "note": "Applied BEFORE the firmware clamp: constrain(angle + servoSubtrim[channel], 0, 180). A trimmed channel therefore saturates on a request that is legal untrimmed."
      },
      "hornSplineOffsetDeg": {
        "value": 0,
        "measured": false,
        "source": "assumed zero; nothing in the repository establishes it",
        "method": "The horn is pressed onto a splined output shaft at assembly, so the commanded-to-physical mapping is quantised at 360/20 = 18 deg and each build lands up to +/-9 deg away from the datum. Unreachable from CAD by construction. Zero is the no-information default, not a finding.",
        "wouldBeConfirmedBy": [
          "Measuring the physical link angle at commanded 90 deg on a specific robot BEFORE any subtrim is applied (checklist V6-20). The residual is this number."
        ],
        "checklistStep": "V6-20",
        "closesIssues": [
          "unresolved:horn-spline-quantisation"
        ]
      },
      "mechanicalLimitsDeg": {
        "value": null,
        "measured": false,
        "source": "hardware/joint-map.json joints[R1].angleLimitsDeg.mechanicalLimitsDeg (null)",
        "method": "Genuinely unknown. The firmware clamp is 0..180 and is authoritative, but nothing says the printed linkage can reach both ends without collision. V0 reconstructed one pose; it swept nothing.",
        "wouldBeConfirmedBy": [
          "A slow single-joint sweep on an elevated robot with the supply current watched for stall (checklist V6-22), or a collision study on repaired meshes."
        ],
        "checklistStep": "V6-22",
        "closesIssues": [
          "ISSUE-20260823-007",
          "unresolved:joint-zero-sign-and-limits"
        ]
      },
      "safeTravelDeg": {
        "value": null,
        "measured": false,
        "source": "not established",
        "method": "A conservative sub-range that is safe to command with the robot elevated and unloaded. Deliberately null: inventing one would give a false sense of safety, and the shipped choreography is the only range anyone has evidence for.",
        "wouldBeConfirmedBy": [
          "Deriving it from the measured mechanical limits with a margin, once V6-22 has run (checklist V6-23)."
        ],
        "checklistStep": "V6-23",
        "closesIssues": [
          "ISSUE-20260823-007"
        ],
        "note": "Until this is filled in, the shipped 395-step choreography is the only commanded range with any evidence behind it - and that is evidence of the firmware authors' intent, not of the mechanism."
      },
      "powerOnCommandedDeg": {
        "value": null,
        "measured": false,
        "source": "firmware/sesame-firmware-main.ino:746 — setup() attaches the servos and deliberately does not command them",
        "method": "Genuinely undetermined, and not a gap in any extractor. Where a horn sits when the servo is attached but never written depends on the servo's own power-on behaviour and on where the builder left it. Null means \"unknown for this joint\"; the whole-robot fallback of 90 is what the simulator uses because RobotState.commandedDeg is a required number.",
        "wouldBeConfirmedBy": [
          "Powering a built robot with no command and reading each link angle with a protractor. V1 costed this at about ten seconds per joint (checklist V6-13)."
        ],
        "checklistStep": "V6-13",
        "closesIssues": [
          "ISSUE-20260823-007"
        ]
      },
      "partIdentity": {
        "value": null,
        "measured": false,
        "source": "hardware/joint-map.json joints[R1].semanticName — verified:false",
        "method": "V0 established from the CAD where the body NAMED this joint belongs. It cannot establish that the servo on this firmware channel drives the printed part ENGRAVED with this name on a particular build: F5 measured R1 = L2, R2 = L1, R3 = L4 and R4 = L3 as identical solids, so two parts can be swapped at assembly and neither the firmware nor the CAD would notice.",
        "wouldBeConfirmedBy": [
          "Reading the engraving on the part actually installed on this servo channel, on a built robot (checklist V6-02). This is the ONLY remaining gap in the spatial name."
        ],
        "checklistStep": "V6-02",
        "closesIssues": [
          "ISSUE-20260823-007",
          "unresolved:parts-installed-where-drawn"
        ],